Title,Image
100 Moroccan Door Designs PDF for CNC Router,https://drive.google.com/thumbnail?id=1a_Z36blN0ie3GCZfviYhncaLic40IyK7&sz=w1000
Premium Moroccan Door Collection PDF for CNC,https://drive.google.com/thumbnail?id=19oYyE55L8SM9FjsojO6ocgKgGU7dEgHU&sz=w1000
Traditional Moroccan Door Patterns CNC PDF,https://drive.google.com/thumbnail?id=11miQwc8oAP1KHrJNJ5INX6J4uKKL1sj5&sz=w1000
Luxury Moroccan Door Designs Ready for CNC,https://drive.google.com/thumbnail?id=1HSGWrBDDvozBXm-Rn2MdAEssS_oU8iRa&sz=w1000
Islamic Moroccan Door Collection PDF,https://drive.google.com/thumbnail?id=1F1N8OgApuMatBVeTamnpysOCCQdPi9N4&sz=w1000
Decorative Moroccan Wooden Doors CNC Files,https://drive.google.com/thumbnail?id=1ls12dN14MGQ9U0MfrZ7LM-21zUX4PulS&sz=w1000
Modern Moroccan Door Designs PDF,https://drive.google.com/thumbnail?id=1WpEUg8t-p9zkk-wIJ8eIIz-1ZOHHBzZc&sz=w1000
Moroccan Royal Door Patterns CNC Pack,https://drive.google.com/thumbnail?id=1GuDj4gz4Or3mLSrxOz46rPEknaqBIY5q&sz=w1000
CNC Moroccan Entrance Door Collection,https://drive.google.com/thumbnail?id=1j1UtAmJVo725d_xKTgUUeF1KdciLeDxN&sz=w1000
Moroccan Door Art PDF for CNC Router,https://drive.google.com/thumbnail?id=12yPKx1-ft3fYYgwPA7g-hWfm57s54KfS&sz=w1000
Classic Moroccan Door Design Bundle,https://drive.google.com/thumbnail?id=1eD9eSJUjPUe6eyrERs-TNarq7f9qYhKs&sz=w1000
Handmade Style Moroccan Door CNC PDF,https://drive.google.com/thumbnail?id=1bbie90nJ0PbvOmnLVUMllJDQ4Gp2gi6r&sz=w1000
Decorative Islamic Door Collection CNC,https://drive.google.com/thumbnail?id=17SO0clQkg5sdkP57AhOKSh_-25NhX8zT&sz=w1000
Moroccan Home Door Designs PDF,https://drive.google.com/thumbnail?id=1jnVCwjv6N8tNwwQ3PB0jOJgyRvuOQgND&sz=w1000
Premium CNC Moroccan Door Templates,https://drive.google.com/thumbnail?id=1mlQdf5Xw8uvrE4pIkP80OhPbZFDursT4&sz=w1000
Traditional Arabic Moroccan Door Pack,https://drive.google.com/thumbnail?id=13MmyooUyFkm00L2Bmus6zVpHTMGkee9f&sz=w1000
Elegant Moroccan Door PDF Collection,https://drive.google.com/thumbnail?id=17z87PE3g0M7BEJfdmUheum_niTFZGRt5&sz=w1000
CNC Router Moroccan Door Bundle,https://drive.google.com/thumbnail?id=1mQqLLZAewhFtQmckU5UKwadX3gLv1iCs&sz=w1000
Moroccan Luxury Entrance Door Files,https://drive.google.com/thumbnail?id=1JDz-BL4bjb8ywQfNuyzv3gmcat40WUji&sz=w1000
Moroccan Islamic Door Art PDF,https://drive.google.com/thumbnail?id=1qOVz8CCR3Aqqnsse2w6ubZ3B_2i-oz9w&sz=w1000
Wooden Moroccan Door CNC Collection,https://drive.google.com/thumbnail?id=1ErBQnDo2Qk5Cab_i3Yu18tx4X5PZ79Tz&sz=w1000
Modern Islamic Moroccan Doors PDF,https://drive.google.com/thumbnail?id=1Vrzp-jpKxEX-kM8duqfc-zo2denqLj2m&sz=w1000
Premium Decorative Door CNC Designs,https://drive.google.com/thumbnail?id=1tr4XlxowZh5ti-2N_cm-IiQbGGdKOqW6&sz=w1000
Moroccan Geometry Door Patterns,https://drive.google.com/thumbnail?id=1VjaFHJHPHDhhzPcCRFzMaKdcI1Jl0EGW&sz=w1000
Ready To Cut Moroccan Doors PDF,https://drive.google.com/thumbnail?id=1QJASZ_2Fb6njQg_3fBYyfS1yg152CQTR&sz=w1000
Laser Cut Moroccan Door Collection,https://drive.google.com/thumbnail?id=1yehK8yfPjCKXAbAwXSFNi3f_Z33nUxX4&sz=w1000
Moroccan Decorative Door Pack,https://drive.google.com/thumbnail?id=1tP5rr1S0KU2eZla7BdA3rYnCm1WBruQm&sz=w1000
High Quality Moroccan Door Designs,https://drive.google.com/thumbnail?id=1N3_zWlZ49NHur2F8whSWp3PgktdAeWjq&sz=w1000
CNC Wood Door Moroccan Collection,https://drive.google.com/thumbnail?id=18tAf81Ip542fSX1fEFOlGBoMBG-641Dj&sz=w1000
Premium Arabic Door PDF Bundle,https://drive.google.com/thumbnail?id=10ksN8Rj-jIyWFJ-ABv3gd0tOQPVN8jBn&sz=w1000
Moroccan Traditional Door Series,https://drive.google.com/thumbnail?id=1gyJ7K8O967NijNNP9OEBJ4FHgsSOQhnH&sz=w1000
Modern Moroccan Gate Designs PDF,https://drive.google.com/thumbnail?id=1D0pj9Pqc7CL1rKycAnbRgZCwBB7iDEG3&sz=w1000
Luxury Moroccan CNC Door Set,https://drive.google.com/thumbnail?id=1OQ_3opBdHlF6JKf_TRKePhcbz4CFdfVh&sz=w1000
Decorative Wooden Door Files,https://drive.google.com/thumbnail?id=1Epsj-oDJa2Ozn0IaGBiEVMMrWjn7WlIM&sz=w1000
Moroccan Interior Door Collection,https://drive.google.com/thumbnail?id=19NF1ZapVOnbRm6S0rLRoDO2qEuhDIF-a&sz=w1000
CNC Moroccan Ornament Door Pack,https://drive.google.com/thumbnail?id=1_QA-EnxP1Y178C77NnzuL0yU7luqso0U&sz=w1000
Islamic Decorative Doors PDF,https://drive.google.com/thumbnail?id=1mfI2Cakd918QpPmYeT_reUsQbs2idH_M&sz=w1000
Moroccan Palace Door Collection,https://drive.google.com/thumbnail?id=1QvzVjgE77ra_PEjmHKT7-_0tw1djKi5x&sz=w1000
Handmade Moroccan Door Templates,https://drive.google.com/thumbnail?id=1vyXG60Q86qbp2iWURum6nVFRnZAJ-s5N&sz=w1000
Moroccan Decorative Panel Doors,https://drive.google.com/thumbnail?id=1dq5n03uJk6ztr3WY2JxQ1V9yjQ_cQGlI&sz=w1000
Elegant Islamic Door Designs,https://drive.google.com/thumbnail?id=1V5F8sYjEXrf_xhakw8wLWNYVYituXFhc&sz=w1000
Premium CNC Moroccan Panels,https://drive.google.com/thumbnail?id=13xNO_cexzd1o-HRlEz4UDcUyTWfyUqjQ&sz=w1000
Royal Moroccan Door Bundle,https://drive.google.com/thumbnail?id=1t_ZVYZM1VsV9L1zoEeDKUp0P7ldO-hkd&sz=w1000
Wooden Decorative Door Collection,https://drive.google.com/thumbnail?id=10UZSRdcQUoRCXLosMmFAHLubnQ1TMhC_&sz=w1000
CNC Moroccan House Doors,https://drive.google.com/thumbnail?id=1ix5g3R1i877BnPzeIowVbNyYTtwxokmr&sz=w1000
Arabic Door Decoration PDF,https://drive.google.com/thumbnail?id=16Z9L8lzXzszXltNOb1PUvcjS0JmZ8cbu&sz=w1000
Premium Moroccan Wall Door Art,https://drive.google.com/thumbnail?id=15LxRUV0XIMdENivTuSOFtYYuwZWpsAbs&sz=w1000
Traditional Door Ornament Collection,https://drive.google.com/thumbnail?id=1_VvDLglv9k6qrfQ-0-O-e9RI9Xl5KHNy&sz=w1000
Moroccan Router Door Designs,https://drive.google.com/thumbnail?id=1MohnVI19_Z26EE0Hez8rlSQfFg9yvM0F&sz=w1000
Decorative Luxury Door Bundle,https://drive.google.com/thumbnail?id=1goxr9ii1ZjhSch15InwCl9nutuZ5EnNW&sz=w1000
Islamic Pattern Door Collection,https://drive.google.com/thumbnail?id=1dDq4U7vwTeEQASivAhoEXkC1ggmMExyh&sz=w1000
Modern Wood Door CNC Pack,https://drive.google.com/thumbnail?id=1dY1ExgCuxJ0yBFTTbusDcmgrdEthHcef&sz=w1000
Moroccan Entry Door Collection,https://drive.google.com/thumbnail?id=1TmzORBCeu_CYaxKlB1ycwmD6ZElITw92&sz=w1000
Classic Moroccan Door Set,https://drive.google.com/thumbnail?id=1C0FQPv4XNrY2UokBz-eu1gH6D1eJNuDU&sz=w1000
Royal Entrance Door PDF,https://drive.google.com/thumbnail?id=1dq3LH85I7PsMk5JjeTBPb6REyDMNcBd4&sz=w1000
Arabic Ornament Door Collection,https://drive.google.com/thumbnail?id=1tS1K6FL6o43oZatgPAOChpTpWFzBwvib&sz=w1000
Premium Islamic Gate Designs,https://drive.google.com/thumbnail?id=1f5CAPc64552Y0pWtmpXJaDf1S8ZY15FM&sz=w1000
Moroccan Heritage Door Pack,https://drive.google.com/thumbnail?id=1zbeUwHi2P1Nu7z0fDEy1hx0DuhVkQ1HM&sz=w1000
Decorative CNC Door Library,https://drive.google.com/thumbnail?id=184MM2lyL6P90mqr-gv2JOhC7eWMHcOxu&sz=w1000
Modern Moroccan Entrance Collection,https://drive.google.com/thumbnail?id=15pni1EuG5u44tTo30qT6ffe255Jxw8Ab&sz=w1000
Islamic Wooden Door Files,https://drive.google.com/thumbnail?id=1Nnf8S4Xw2xYRwKICHsdimVncnh3xMyuh&sz=w1000
Moroccan Art Door Templates,https://drive.google.com/thumbnail?id=16JsoKNRdfglQ-dJeHby6Lchk6e87O_Cg&sz=w1000
Traditional Door PDF Collection,https://drive.google.com/thumbnail?id=1gZ9obFOKsHwMxSpUcd32U77ZBj8QeDlq&sz=w1000
CNC Door Master Collection,https://drive.google.com/thumbnail?id=1va7ytLrbiZ0g2dSoD4Ax0D1A8cY51cOO&sz=w1000
Premium Laser Door Designs,https://drive.google.com/thumbnail?id=1eQPsvcp8cIlRfHLPGmv5UyiFMv6p2CGC&sz=w1000
Moroccan Interior Ornament Doors,https://drive.google.com/thumbnail?id=1OYhx9Mv0ec2CSjgxrcKP1d5ywYc5T-JE&sz=w1000
Decorative House Door Pack,https://drive.google.com/thumbnail?id=1LVmMNmT-hi93Vxc0wcoIfnRnuv2Gz_6f&sz=w1000
Islamic CNC Router Doors,https://drive.google.com/thumbnail?id=1H0D7XqVZJvhByU_imd1tYsBkC_FE7WFv&sz=w1000
Luxury Moroccan Entrance Set,https://drive.google.com/thumbnail?id=1BEEqq-iORRFox3QsPR6SUrWowRdzliZY&sz=w1000
Modern Decorative Door Library,https://drive.google.com/thumbnail?id=1o2kj7jsO-HVmbHQwHspSsymcLxuUFZ4I&sz=w1000
Moroccan Wood Ornament Collection,https://drive.google.com/thumbnail?id=1H8UI5TvD9oCc73X5LgODgmxiI4SSizjD&sz=w1000
Royal Islamic Door Art,https://drive.google.com/thumbnail?id=1ZuFYf0Ndc5ZVvP2UFdnCIq5FtZCXnwxK&sz=w1000
Traditional Moroccan Panel Pack,https://drive.google.com/thumbnail?id=1I47UohLRya2rk_GbLIoC1gPGI8oGtsjC&sz=w1000
Decorative Router Door Collection,https://drive.google.com/thumbnail?id=1lt5qQe-D3FQgtCz0xzHNVrSJgyPEAB_9&sz=w1000
CNC Premium Door Library,https://drive.google.com/thumbnail?id=1JgUG_qcFMDbQGTBc-BdpHSIBPA1ai79p&sz=w1000
Elegant Moroccan Wood Doors,https://drive.google.com/thumbnail?id=1xHxZbZjmHc4fIi11MqHkHi5lwW62xJdc&sz=w1000
Modern Arabic Door Collection,https://drive.google.com/thumbnail?id=1FyDv08uFjWOchmzkuiayyIN1jYnOZFJh&sz=w1000
Decorative Islamic Door Bundle,https://drive.google.com/thumbnail?id=1_ajuYx3KYcxFxEq0aiKtKlMt26Ch9w7G&sz=w1000
Premium Router Door Designs,https://drive.google.com/thumbnail?id=1iZag1Ij-6vSRsG69egXxBNUAGVYlGF7o&sz=w1000
Moroccan Home Decoration Doors,https://drive.google.com/thumbnail?id=1JH31-CU_4lPor9wbYPile2_DRxiiAT4R&sz=w1000
Islamic Luxury Door Collection,https://drive.google.com/thumbnail?id=1dV3oeTX328Pg5of6UhjSkm_uFHct0AI2&sz=w1000
Wooden CNC Door Art,https://drive.google.com/thumbnail?id=10yyyADVegVK-WQ61M7Y61ESn31oLsRF7&sz=w1000
Traditional Moroccan Design Set,https://drive.google.com/thumbnail?id=12nhEk4f9ZOsTNZR7roF7sKDwXl3ac3Xg&sz=w1000
Premium Entry Door Collection,https://drive.google.com/thumbnail?id=1odIJnErwuZbe_u1kKcBuE4koi5QBvzEX&sz=w1000
Moroccan Gate Decoration PDF,https://drive.google.com/thumbnail?id=1rLTy87sPElcgKPdfGrYcOkBFrU-uJT-5&sz=w1000
Router Ready Door Designs,https://drive.google.com/thumbnail?id=1aGEPm3PBf7S22ZvhYGy4-O0nMD0kLhnG&sz=w1000
Decorative Entrance Door Files,https://drive.google.com/thumbnail?id=15kGarWSTR1FkzuJAJEuGpKSQ38oi-osI&sz=w1000
Modern Luxury Door Pack,https://drive.google.com/thumbnail?id=1USt5UwiKVcyPXWXs6KTK5bH7BzzWtifU&sz=w1000
Moroccan Ornament Collection,https://drive.google.com/thumbnail?id=1GD-d3_FgA_lb2Y1pN2spguxYM5b4sxCW&sz=w1000
Islamic Home Door Designs,https://drive.google.com/thumbnail?id=1lrdelEkmbDcLKUH0swoQn7zFj6LDC6Pm&sz=w1000
Premium Decorative Panels PDF,https://drive.google.com/thumbnail?id=1aQULtL2v0ZBHJR1-i_vvTTEmA6FliQ_V&sz=w1000
Traditional Arabic Door Files,https://drive.google.com/thumbnail?id=1Cog2d1yPBNVu3VTDDEJ64EpXbkv30Oqq&sz=w1000
Moroccan Door Decor Collection,https://drive.google.com/thumbnail?id=1hk62RMoI8EYe7AtCJ8rv9Nn3mHbqF8nV&sz=w1000
CNC Router Door Templates,https://drive.google.com/thumbnail?id=1X1cBRO1pfsDeUgwbiC7YYEVdw-tgz8xk&sz=w1000
Modern Gate Design Pack,https://drive.google.com/thumbnail?id=1zSigEP5dGs3y6XR1OASIWJ-2BxvNKtdf&sz=w1000
Decorative House Entrance Files,https://drive.google.com/thumbnail?id=1NsyXHVGF4h778Fuj_3tHmXfzMfeqF3xb&sz=w1000
Premium Ornament Door Bundle,https://drive.google.com/thumbnail?id=13kmTlPMZUyMvnH2HefhybatuLNkiD3jE&sz=w1000
Royal Moroccan Collection,https://drive.google.com/thumbnail?id=1KD2r8lARLXMK3QlqZQ4dmvW3OObfsgO5&sz=w1000
Luxury Decorative Door Art,https://drive.google.com/thumbnail?id=1RPcojefnaV9yNGpl0riFTlbkfzLSoDK3&sz=w1000
Ready CNC Moroccan Designs,https://drive.google.com/thumbnail?id=1WzL030DqkNHPmOhBs1aTu6pQJE4xcl-e&sz=w1000
Islamic Door Design Library,https://drive.google.com/thumbnail?id=1JptUnafyqWeRqUrkM58ZRFMtqYSnt1BP&sz=w1000
Decorative Router Collection,https://drive.google.com/thumbnail?id=10jAfYsP_HTclNbOMc3imIuk1vkhitqBV&sz=w1000
Moroccan Decorative Architecture,https://drive.google.com/thumbnail?id=15ZjDONqPPg7JrjBgaD4CoQzv09-KtYGh&sz=w1000
Traditional Door Pattern Set,https://drive.google.com/thumbnail?id=10rB4NEns0r_FSmlJORPX8id3d8YDrWgR&sz=w1000
Premium Gate Collection,https://drive.google.com/thumbnail?id=1lia6Db9y1crRuW9uZAh7hxbxsfwG-X7q&sz=w1000
Elegant CNC Door Files,https://drive.google.com/thumbnail?id=1NdCKfWS95IBc1ifutfiyNLLqMbqxN_wp&sz=w1000
Decorative Islamic Panels,https://drive.google.com/thumbnail?id=15q8Mil2TEBcdEorvvxxJVXXwiDWiEED3&sz=w1000
Moroccan Interior Collection,https://drive.google.com/thumbnail?id=1yaaaD7Y5Z0aydB12SkeRwUH3set4j81Y&sz=w1000
Premium Router Templates,https://drive.google.com/thumbnail?id=15f8F-nvJDiH093Lu2ANBUqBXwsk9tcPu&sz=w1000
Modern Door Ornament Files,https://drive.google.com/thumbnail?id=14wYq5DcWQjdpBoQYctgj3sPPvbCxxs95&sz=w1000
Luxury Arabic Door Set,https://drive.google.com/thumbnail?id=1AUsH8AXXFK71JdLPQ6gB3tUkJI-otqpl&sz=w1000
Traditional Entry Door Collection,https://drive.google.com/thumbnail?id=1eeX_H2azRJWDN6RLWVG2LkycTW7DDblg&sz=w1000
Decorative House Door Templates,https://drive.google.com/thumbnail?id=1S-ux4XPNosPpCTqFhy1ZSixva-Nozg0H&sz=w1000
Islamic Door Ornament Pack,https://drive.google.com/thumbnail?id=1VZNDgxMaTh76h_59Dy-YktjGLt6tZklH&sz=w1000
Moroccan CNC Library,https://drive.google.com/thumbnail?id=1Wq_8gvvuF7sAX4KApqqPmdE29laA6G3w&sz=w1000
Premium Decorative Collection,https://drive.google.com/thumbnail?id=1nIWNyo0LPr1fP6TAWEaY_05CsVYwi_un&sz=w1000
Luxury Entrance Door Files,https://drive.google.com/thumbnail?id=1ifeDOaqolsK-oPeh2VKyUEk7BlVpDkZv&sz=w1000
Router Door Art Collection,https://drive.google.com/thumbnail?id=12BOykFXuqx08YviRFK0CqOHlNmtKCbMK&sz=w1000
Decorative Wood Ornament Pack,https://drive.google.com/thumbnail?id=11T_35NcQt_0Rt3X5akUNxT56Eu2O5wxj&sz=w1000
Moroccan Royal Collection PDF,https://drive.google.com/thumbnail?id=1oPRouRRhsuuSGYFMA4b9R3iDx9gLcuA0&sz=w1000
Modern Decorative Gate Files,https://drive.google.com/thumbnail?id=1eBy-fnn4oY9JpKTSIJta1rs-omQWo4m_&sz=w1000
Premium Door Ornament Library,https://drive.google.com/thumbnail?id=1eY_v19cSZSivRtg_sDKbI6O3WDHRh81W&sz=w1000
Islamic Decorative Bundle,https://drive.google.com/thumbnail?id=1OTNT0APhYYoh-m4WhzgTWIqV9fCz0vcg&sz=w1000
Moroccan Router Collection,https://drive.google.com/thumbnail?id=1EwmIx1t1ktpV4QhDtRhREASiQ14C5Jcz&sz=w1000
Traditional Decorative Set,https://drive.google.com/thumbnail?id=1ejjZVKTPxIeMv-nbStGUNptQaNljtVnu&sz=w1000
Decorative CNC Ornament,https://drive.google.com/thumbnail?id=1ET5pP4Y1_mtQcSYbfCQn2gvGb4VSf5Lo&sz=w1000
Luxury Wooden Door Pack,https://drive.google.com/thumbnail?id=15lRoGYmQRu_g_nU9ZQnn84FKwHZsCmOX&sz=w1000
Premium Islamic Collection,https://drive.google.com/thumbnail?id=1rUQRBu-fBFbQkzTR-Vt_cZwGvSLssmds&sz=w1000